{
  "schema_version": 2,
  "diagram_type": "workflow",
  "meta": {
    "title": "Sanitized semantic labels",
    "output": "issue-126-labels.html",
    "legend": { "mode": "hidden" }
  },
  "lanes": [
    { "id": "main", "label": "Main flow" }
  ],
  "nodes": [
    { "id": "request", "lane": "main", "col": 3, "type": "actor", "label": "Request" },
    { "id": "result", "lane": "main", "col": 4, "type": "action", "label": "Result" }
  ],
  "edges": [
    { "id": "request-result", "from": "request", "to": "result", "label": "同步 ✅ ready" }
  ]
}
